<?xml version="1.0" encoding="UTF-8"?>
<!--
/**
 * Sample
 *
 * @package Genmato_Sample
 * @author  Vladimir Kerkhoff <support@genmato.com>
 * @created 2015-12-22
 * @copyright Copyright (c) 2015 Genmato BV, https://genmato.com.
 */
-->
<xs:schema xmlns:xs="http://www.w3.org/2001/XMLSchema">
    <xs:element name="table">
        <xs:complexType>
            <xs:sequence>
                <xs:element name="row" maxOccurs="unbounded" minOccurs="0">
                    <xs:complexType>
                        <xs:sequence>
                            <xs:element name="column" maxOccurs="unbounded" minOccurs="0">
                                <xs:complexType>
                                    <xs:sequence>
                                        <xs:element type="xs:string" name="label">
                                            <xs:annotation>
                                                <xs:documentation>from first xml  from second xmlthey apear in both xmls with the same path and id and second one overrides the value for `attr1` from first xml  from first xml</xs:documentation>
                                            </xs:annotation>
                                        </xs:element>
                                    </xs:sequence>
                                    <xs:attribute type="xs:string" name="id" use="optional"/>
                                    <xs:attribute type="xs:byte" name="sort" use="optional"/>
                                    <xs:attribute type="xs:string" name="attr1" use="optional"/>
                                    <xs:attribute type="xs:string" name="disabled" use="optional"/>
                                </xs:complexType>
                            </xs:element>
                        </xs:sequence>
                        <xs:attribute type="xs:string" name="id" use="optional"/>
                    </xs:complexType>
                </xs:element>
            </xs:sequence>
        </xs:complexType>
    </xs:element>
</xs:schema>